nom;prix;ingrédients;
Mozaccia;9.80;Base tomate, Mozarella, cresson, jambon fumé, ail, artichaut, champignon, parmesan, poivre, olive noire;
Gorgonzollaccia;10.80;Base tomate, Gorgonzola, cresson, ail, champignon, parmesan, poivre, olive noire;
Raclaccia;8.90;Base tomate, raclette, cresson, ail, champignon, parmesan, poivre;
Emmentalaccia;9.80;Base crème, Emmental, cresson, champignon, parmesan, poivre, oignon;
Tradizione;8.90;Base tomate, Mozarella, cresson, jambon cuit, champignon(80), parmesan, poivre, olive noire(10), olive verte(10);
Hawaienne;11.20;Base tomate, Mozarella, cresson, bacon, ananas, piment, parmesan, poivre, olive noire;
Américaine;10.80;Base tomate, Mozarella, cresson, bacon, pomme de terre(40), parmesan, poivre, olive noire;
Paysanne;12.80;Base crème, Chèvre, cresson, pomme de terre, jambon fumé, ail, artichaut, champignon, parmesan, poivre, olive noire, œuf;